{
  "task_id": "a3e9c1d57f2b4a6e8d0c1b2a3f4e5d61",
  "reader": "bvbrc:areader",
  "verdict": "non-minimal",
  "span_judgements": [
    {
      "set": 1,
      "span": 1,
      "judgement": "non-minimal"
    },
    {
      "set": 2,
      "span": 1,
      "judgement": "located"
    }
  ],
  "extra_answers": [],
  "notes": "Set 1 carries the definition sentences; sentence 4 alone supports the melena finding.",
  "version": 2,
  "saved_at": "2026-09-06T15:12:40Z"
}
